<?xml version="1.0"?>

<simulatedAnnealing xmlns:xsi="http://www.w3.org/2001/XMLSchema-instance"
        xsi:noNamespaceSchemaLocation="simulatedAnnealing.xsd">
<noEpsilon>4</noEpsilon>
<rt>0.3</rt>
<T>20</T>
<NS>15</NS>
<NT>5</NT>
<epsilon>1.E-3</epsilon>
<maxNoEval>3000000</maxNoEval>
</simulatedAnnealing>        
